input_id,input_name,role_in_new_design,source_rows,evidence_rows,case_rows,quote_rows,review_rows,status
PKG001,research_evidence_package_clinician_side_diagnostic_pain_points_2026-05-30.tar.gz,"Clinician pain points: alert overload, result follow-up, handoffs, time pressure, low-resource constraints.",24,21,4,13,0,included as archive and synthesized via Research F
PKG002,research_evidence_package_global_health_issue_identification_2026-05-30.tar.gz,"Global and regional adaptations: gatekeeper/open-access systems, low-resource, CHW, public/private fragmentation, cultural safety.",30,30,10,3,0,included as archive and synthesized via Research F
PKG003,research_evidence_package_health_system_patient_flows_2026-05-30.tar.gz,"Patient-flow and black-zone map: intake, triage, labs, discharge, follow-up, referral, repeat visit.",56,53,53,5,10,included as archive and synthesized via Research F
PKG004,research_evidence_package_missed_signals_diagnostic_errors_2026-05-30.tar.gz,"Missed-signal taxonomy: normal-test trap, repeated visits ignored, abnormal result not followed, dismissal, no one connected dots.",15,32,32,7,9,included as archive and synthesized via Research F
PKG005,research_evidence_package_patient_complaints_identification_failures_2026-05-30.tar.gz,"Patient voice and complaint evidence: not listened to, dismissed, wrong specialty, normal-test reassurance, positive listening examples.",39,18,18,20,19,included as archive and synthesized via Research F
PKG006,research_evidence_package_product_design_synthesis_2026-05-30.tar.gz,"Research F: product insights, feature backlog, black-zone map, data schema, safety risks, region adaptations.",164,154,117,48,38,included as archive and direct design input
PKG007,shared_health_memory_research_package_2026-05-30.tar.gz,"Research G / Shared Health Memory: health threads, six memories, Capture-Connect-Clarify-Close-Correct loop.",21,17,unknown,unknown,unknown,included as archive and direct design input
