risk_id,risk_name,affected_user,possible_failure_mode,guardrail,supporting_source_ids,date_packaged,research_topic
R001,Autonomous diagnosis risk,Patient/clinician,Patient acts on generated diagnosis or clinician over-trusts system.,Do not present final diagnoses; use memory/uncertainty language; require clinician review.,S015;S016;S017,2026-05-30,Shared Health Memory: a medical second-brain approach for unresolved health issues
R002,Alert fatigue,Clinician,Too many flags cause important signals to be ignored.,Prioritize unresolved/pending/high-risk items; monitor alert burden and false positives.,S014;S015,2026-05-30,Shared Health Memory: a medical second-brain approach for unresolved health issues
R003,Raw data overload,Clinician,Patient logs or wearables create noise and burden.,"Show trends and baseline changes, not raw streams by default.",S013;S014,2026-05-30,Shared Health Memory: a medical second-brain approach for unresolved health issues
R004,False reassurance,Patient/clinician,Normal tests cause unresolved symptoms to be ignored.,Track normal-test-but-symptoms-persist state.,S003;S008;S011,2026-05-30,Shared Health Memory: a medical second-brain approach for unresolved health issues
R005,Unclear ownership,Patient/admin/clinician,Pending results/referrals have no accountable owner.,"Every pending item requires owner, due date, status, and escalation path.",S010;S011;S012,2026-05-30,Shared Health Memory: a medical second-brain approach for unresolved health issues
R006,Patient correction conflict,Patient/clinician,Patient corrections silently overwrite clinical record or create medico-legal conflict.,Use review queue; mark patient-reported vs clinician-verified; preserve audit trail.,S005;S016,2026-05-30,Shared Health Memory: a medical second-brain approach for unresolved health issues
R007,Bias amplification,Patient,"System may reproduce dismissal patterns around gender, race, age, weight, disability, mental health, or language.",Track dismissal/minimization signals carefully; audit outcomes; avoid accusatory language.,S003;S020;S021,2026-05-30,Shared Health Memory: a medical second-brain approach for unresolved health issues
R008,Regulatory misclassification,Company/clinician/patient,Product claims may move tool into regulated CDS/device territory.,Define intended use carefully; maintain transparency and clinician review; get regulatory counsel.,S017,2026-05-30,Shared Health Memory: a medical second-brain approach for unresolved health issues
